{
  "routine_id": "mirror-bridge-verification-daily-v1",
  "workflow_id": "mirror-bridge-verification-v1",
  "skill_id": "mirror-bridge-verification",
  "status": "SYM",
  "trigger": {"kind": "cron", "value": "0 6 * * *"},
  "idempotency_key": "mirror-bridge:{head_sha}:{proposal_sha256}",
  "retry_policy": {"max_attempts": 2, "on_exhausted": "escalate"},
  "approval": {
    "required": true,
    "boundary": "mirror conflict, unknown required check, provenance failure, or scientific-status promotion"
  },
  "heartbeat_on_empty": true,
  "confusion_guard": "An empty heartbeat means no eligible delta was found in this cycle; it does not prove scientific completeness."
}
